Time,Task
Time,Task
09:00 - 10:30,Review physics notes and textbook chapters relevant to the exam
10:30 - 10:45,Short break to stretch or relax
10:45 - 12:15,Practice solving physics problems and past exam questions
12:15 - 13:00,Lunch break
13:00 - 14:00,Create and review flashcards or summaries of key physics concepts and formulas
14:00 - 14:15,Short break to recharge
14:15 - 15:45,Review physics notes and textbook chapters relevant to the exam (continued)
15:45 - 16:00,Short break
16:00 - 17:00,Go for grocery shopping
17:00 - 18:00,Practice solving physics problems and past exam questions (continued)
